{
	"schemaVersion": 1,
	"stage": "stage-10d-start",
	"capturedAt": "2026-08-07T14:17:28.160Z",
	"run": {
		"id": "stage10d-20260807t141711z-1427f906",
		"logRoot": "evidence/stage-10d-start-run"
	},
	"source": {
		"baseSha": "4859e086be715206c7a83ec089b7475d40a274e3",
		"implementationSha": "1427f9063d6a502b81f3f98b69b6820b735f3ada",
		"treeClean": true,
		"declaredMode": "skeleton",
		"devServer": "wrangler",
		"ssrMode": "buffered",
		"repairedTsconfig": "tsconfig.start.base.json",
		"forbiddenTypes": ["@tanstack/react-router/globals"],
		"cloudflareFamily": {
			"@cloudflare/vite-plugin": "1.43.0",
			"@cloudflare/vitest-pool-workers": "0.18.0",
			"wrangler": "4.107.0",
			"miniflare": "4.20260701.0",
			"workerd": "1.20260701.1",
			"vite": "8.1.4"
		},
		"buildToolPeerRange": "^6.1.0 || ^7.0.0 || ^8.0.0",
		"lockfileChanged": false,
		"harnessBindPort": 0,
		"harnessListeners": 2,
		"typescriptCatalogPin": "5.9.3"
	},
	"host": {
		"os": "darwin",
		"architecture": "arm64",
		"kernel": "25.5.0",
		"insideDevcontainer": false,
		"bunVersion": "1.3.13",
		"gitVersion": "2.50.1",
		"ghVersion": "2.59.0"
	},
	"repository": {
		"nameWithOwner": "MrChrisRodriguez/devenv",
		"workflowFile": ".github/workflows/ci.yml",
		"gateJobId": "ci-gate",
		"gateContext": "CI gate",
		"gateNeeds": [
			"ci",
			"image",
			"affected",
			"project",
			"moon-graph",
			"browser"
		],
		"startGuardScript": "start:check",
		"familyGuardScript": "toolchain:check",
		"ciGuardScript": "ci:check",
		"registryFile": "start-surface.json",
		"capability": "tanstack_start",
		"capabilityDependencies": ["cloudflare_workers", "vite_websocket_proxy"],
		"addedJobs": 0,
		"devcontainerFilesChanged": 0
	},
	"commands": [
		{
			"id": "start-guard",
			"command": ["bun", "run", "start:check"],
			"runId": "stage10d-20260807t141711z-1427f906",
			"startedAt": "2026-08-07T14:17:11.892Z",
			"completedAt": "2026-08-07T14:17:12.177Z",
			"durationMs": 285,
			"stdoutPath": "evidence/stage-10d-start-run/start-guard.stdout",
			"stderrPath": "evidence/stage-10d-start-run/start-guard.stderr",
			"stdoutSha256": "b9da17f72d7c4adefb31b352dbbd83f5d410410540b22820ea32a7f55908bdd6",
			"stderrSha256": "352a7f6820dab372c0b5560f841f0a7ea7fbfe60fea0f0ba43d3f9c1def5b465",
			"exitCode": 0,
			"status": "pass"
		},
		{
			"id": "family-guard",
			"command": ["bun", "run", "toolchain:check"],
			"runId": "stage10d-20260807t141711z-1427f906",
			"startedAt": "2026-08-07T14:17:12.177Z",
			"completedAt": "2026-08-07T14:17:12.616Z",
			"durationMs": 439,
			"stdoutPath": "evidence/stage-10d-start-run/family-guard.stdout",
			"stderrPath": "evidence/stage-10d-start-run/family-guard.stderr",
			"stdoutSha256": "3fd2b95593a7482b057943f927e5ee77dda508eadd485ee0574ed41fb20518e6",
			"stderrSha256": "7b673fdb2eaf9541313beae59744635aeb03a86d30a1277bd3a71da3a1fe7193",
			"exitCode": 0,
			"status": "pass"
		},
		{
			"id": "ci-guard",
			"command": ["bun", "run", "ci:check"],
			"runId": "stage10d-20260807t141711z-1427f906",
			"startedAt": "2026-08-07T14:17:12.616Z",
			"completedAt": "2026-08-07T14:17:12.677Z",
			"durationMs": 61,
			"stdoutPath": "evidence/stage-10d-start-run/ci-guard.stdout",
			"stderrPath": "evidence/stage-10d-start-run/ci-guard.stderr",
			"stdoutSha256": "9cfe650e97435463f535e1a81f5b30b1ab521cfb458af04688f901be57a294f9",
			"stderrSha256": "d183538a63c244d8ba196aa5a8eb1eb4cfc636414a9ba546e4cfb9b3537e4088",
			"exitCode": 0,
			"status": "pass"
		},
		{
			"id": "start-mutations",
			"command": ["bun", "test", "scripts/template/__tests__/start.test.ts"],
			"runId": "stage10d-20260807t141711z-1427f906",
			"startedAt": "2026-08-07T14:17:12.677Z",
			"completedAt": "2026-08-07T14:17:18.443Z",
			"durationMs": 5766,
			"stdoutPath": "evidence/stage-10d-start-run/start-mutations.stdout",
			"stderrPath": "evidence/stage-10d-start-run/start-mutations.stderr",
			"stdoutSha256": "ca35b94f2c5b623fccbd1cc9e77eef3e30a6fcf4b045842fc1353f7ae6d8ea32",
			"stderrSha256": "6bb605b2e067f1ca1d3f66c73fb465b5c57b4ad691761a9210ad4d73e0814c89",
			"exitCode": 0,
			"status": "pass"
		},
		{
			"id": "tsconfig-mutations",
			"command": [
				"bun",
				"test",
				"scripts/template/__tests__/start.test.ts",
				"-t",
				"the shared TypeScript base, as a declaration"
			],
			"runId": "stage10d-20260807t141711z-1427f906",
			"startedAt": "2026-08-07T14:17:18.443Z",
			"completedAt": "2026-08-07T14:17:19.054Z",
			"durationMs": 611,
			"stdoutPath": "evidence/stage-10d-start-run/tsconfig-mutations.stdout",
			"stderrPath": "evidence/stage-10d-start-run/tsconfig-mutations.stderr",
			"stdoutSha256": "ca35b94f2c5b623fccbd1cc9e77eef3e30a6fcf4b045842fc1353f7ae6d8ea32",
			"stderrSha256": "7d6d0a595c3c3f8a9863a79ea9b4168032a5588615aa4b61bb1bdadf755a3562",
			"exitCode": 0,
			"status": "pass"
		},
		{
			"id": "family-mutations",
			"command": [
				"bun",
				"test",
				"scripts/template/__tests__/toolchain.test.ts",
				"-t",
				"the Cloudflare family governs the build tool it is loaded by"
			],
			"runId": "stage10d-20260807t141711z-1427f906",
			"startedAt": "2026-08-07T14:17:19.054Z",
			"completedAt": "2026-08-07T14:17:19.133Z",
			"durationMs": 79,
			"stdoutPath": "evidence/stage-10d-start-run/family-mutations.stdout",
			"stderrPath": "evidence/stage-10d-start-run/family-mutations.stderr",
			"stdoutSha256": "e9eae5df282edeb49e76dd67ca753a1d3ea526026e2162b6250f9ccb10f1603f",
			"stderrSha256": "e4b0d6108d658b8320e2992f2760de3a8d75f56d300537e4d147cad405846b12",
			"exitCode": 0,
			"status": "pass"
		},
		{
			"id": "ssr-policy",
			"command": [
				"bun",
				"test",
				"scripts/template/__tests__/start.test.ts",
				"-t",
				"the server render policy is a declared matrix"
			],
			"runId": "stage10d-20260807t141711z-1427f906",
			"startedAt": "2026-08-07T14:17:19.134Z",
			"completedAt": "2026-08-07T14:17:19.694Z",
			"durationMs": 560,
			"stdoutPath": "evidence/stage-10d-start-run/ssr-policy.stdout",
			"stderrPath": "evidence/stage-10d-start-run/ssr-policy.stderr",
			"stdoutSha256": "ca35b94f2c5b623fccbd1cc9e77eef3e30a6fcf4b045842fc1353f7ae6d8ea32",
			"stderrSha256": "2e6c5228361fb795dfb8e7aa6b8ce118fa4560fb7d36247378074908eb23c8e3",
			"exitCode": 0,
			"status": "pass"
		},
		{
			"id": "worker-config",
			"command": [
				"bun",
				"test",
				"scripts/template/__tests__/start.test.ts",
				"-t",
				"the hand-written worker configuration is reconciled"
			],
			"runId": "stage10d-20260807t141711z-1427f906",
			"startedAt": "2026-08-07T14:17:19.695Z",
			"completedAt": "2026-08-07T14:17:20.331Z",
			"durationMs": 636,
			"stdoutPath": "evidence/stage-10d-start-run/worker-config.stdout",
			"stderrPath": "evidence/stage-10d-start-run/worker-config.stderr",
			"stdoutSha256": "ca35b94f2c5b623fccbd1cc9e77eef3e30a6fcf4b045842fc1353f7ae6d8ea32",
			"stderrSha256": "e9c727293820a15de391098fecd21a91c66c9ff2df28cecf8f4b8bcb71dc355d",
			"exitCode": 0,
			"status": "pass"
		},
		{
			"id": "built-artifact",
			"command": [
				"bun",
				"test",
				"scripts/template/__tests__/start.test.ts",
				"-t",
				"the built worker configuration is the only portable proof"
			],
			"runId": "stage10d-20260807t141711z-1427f906",
			"startedAt": "2026-08-07T14:17:20.332Z",
			"completedAt": "2026-08-07T14:17:20.820Z",
			"durationMs": 488,
			"stdoutPath": "evidence/stage-10d-start-run/built-artifact.stdout",
			"stderrPath": "evidence/stage-10d-start-run/built-artifact.stderr",
			"stdoutSha256": "ca35b94f2c5b623fccbd1cc9e77eef3e30a6fcf4b045842fc1353f7ae6d8ea32",
			"stderrSha256": "32103836c1d53c893d45ff44665a8e555c0d8f36686aae9e073936918fe62cc4",
			"exitCode": 0,
			"status": "pass"
		},
		{
			"id": "namespace-drift",
			"command": [
				"bun",
				"test",
				"scripts/template/__tests__/start.test.ts",
				"-t",
				"the asset namespace is one decision spelled three ways"
			],
			"runId": "stage10d-20260807t141711z-1427f906",
			"startedAt": "2026-08-07T14:17:20.820Z",
			"completedAt": "2026-08-07T14:17:21.152Z",
			"durationMs": 332,
			"stdoutPath": "evidence/stage-10d-start-run/namespace-drift.stdout",
			"stderrPath": "evidence/stage-10d-start-run/namespace-drift.stderr",
			"stdoutSha256": "ca35b94f2c5b623fccbd1cc9e77eef3e30a6fcf4b045842fc1353f7ae6d8ea32",
			"stderrSha256": "afc60b4dc059cfcac92d887c34e1a485a122523263fef746d2281b7490364369",
			"exitCode": 0,
			"status": "pass"
		},
		{
			"id": "route-tree",
			"command": [
				"bun",
				"test",
				"scripts/template/__tests__/start.test.ts",
				"-t",
				"the generated route tree is governed as a committed artefact"
			],
			"runId": "stage10d-20260807t141711z-1427f906",
			"startedAt": "2026-08-07T14:17:21.153Z",
			"completedAt": "2026-08-07T14:17:21.453Z",
			"durationMs": 300,
			"stdoutPath": "evidence/stage-10d-start-run/route-tree.stdout",
			"stderrPath": "evidence/stage-10d-start-run/route-tree.stderr",
			"stdoutSha256": "ca35b94f2c5b623fccbd1cc9e77eef3e30a6fcf4b045842fc1353f7ae6d8ea32",
			"stderrSha256": "c327297ef8df63f3db1ccbf49488bd87bb7a299c3cc13b9fe16b66619cf6e316",
			"exitCode": 0,
			"status": "pass"
		},
		{
			"id": "router-options",
			"command": [
				"bun",
				"test",
				"scripts/template/__tests__/start.test.ts",
				"-t",
				"the router options are decisions rather than defaults"
			],
			"runId": "stage10d-20260807t141711z-1427f906",
			"startedAt": "2026-08-07T14:17:21.453Z",
			"completedAt": "2026-08-07T14:17:21.721Z",
			"durationMs": 268,
			"stdoutPath": "evidence/stage-10d-start-run/router-options.stdout",
			"stderrPath": "evidence/stage-10d-start-run/router-options.stderr",
			"stdoutSha256": "ca35b94f2c5b623fccbd1cc9e77eef3e30a6fcf4b045842fc1353f7ae6d8ea32",
			"stderrSha256": "7f71924b65a58725a7fa30cda95c1e524b593355031780a0db2382a146d295dd",
			"exitCode": 0,
			"status": "pass"
		},
		{
			"id": "proxy-reconciliation",
			"command": [
				"bun",
				"test",
				"scripts/template/__tests__/start.test.ts",
				"-t",